code,product_name,brands,categories,additives_tags,allergens_tags,ingredients_text,nutrition_grades,image_url,energy_100g,proteins_100g,carbohydrates_100g,sugars_100g,fat_100g,saturated-fat_100g,salt_100g,fiber_100g,additives_count,allergens_count,nutrient_score
8904004400755,,Haldiram,Snacks,,[],,d,https://images.openfoodfacts.org/images/products/890/400/440/0755/front_fr.3.400.jpg,2393.0,8.97,46.1,0.0,37.4,16.5,0.0,4.04,,0.0,6.0
8901123005403,Lotto Choco Pie With Rich Marshmallow,Lotte,Snacks,"['en:e202', 'en:e281', 'en:e322', 'en:e401', 'en:e406', 'en:e407', 'en:e415', 'en:e420', 'en:e422', 'en:e440', 'en:e461', 'en:e476', 'en:e503']","['en:gluten', 'en:milk']","CHOCO COVERING (25%) [SUGAR, HYDROGENATED VEGETABLE FAT (PALM), COCOA SOLIDS, MILK SOLIDS, EMULSIFIERS (322,476), ARTIFICIAL FLAVOUR (VANILLA)], WHEAT FLOUR (MAIDA), SUGAR, LIQUID GLUCOSE, INTERESTERIFIED & HYDROGENATED VEGETABLE FAT (PALM), HUMECTANTS(420, 422), RAISING AGENTS 1500(ii), 503(ii)]. MILK SOLIDS, DEXTROSE, PRESERVATIVES (202, 281), 1ODISED SALT, STABILIZERS (407, 406, 440, 401, 461, 415), ACIDITY REGULATOR 1341(i)] AND ARTIFICIAL FLAVOUR (MILK). cal diet)",e,https://images.openfoodfacts.org/images/products/890/112/300/5403/front_en.24.400.jpg,1820.0,3.93,66.1,37.1,17.1,12.9,1.91,,13.0,2.0,0.0
8901207004414,REAL litchi juice (2) 1ltr tpk,,,,[],,unknown,https://images.openfoodfacts.org/images/products/890/120/700/4414/front_en.18.400.jpg,,,,,,,,,,0.0,5.0
8904258700540,alphonso mango juice,Raw Pressery,Mango juice,"['en:e224', 'en:e300']",[],"ALPHONSO MANGO PULP (51%), WATER, FRUCTOSE, ANTIOXIDANTS [(VITAMIN C-INS 300), INS 224]",c,https://images.openfoodfacts.org/images/products/890/425/870/0540/front_en.12.400.jpg,174.0,0.45,10.43,3.41,0.0,0.0,0.0026,0.91,2.0,0.0,5.0
8901030532719,kissan fresh Tamato,Kissan,Condiments,"['en:e1422', 'en:e211', 'en:e260', 'en:e415']",[],"WATER, TOMATO PASTE (28%), SUGAR, IODISED SALT, ACIDITY REGULATOR - 260, STABILIZERS - 1422, 415, PRESERVATIVE - 211, ONION POWDER, GARLIC POWDER, SPICES AND CONDIMENTS.",e,https://images.openfoodfacts.org/images/products/890/103/053/2719/front_en.27.400.jpg,560.0,1.33,30.7,29.3,0.667,0.0,2.4,0.667,4.0,0.0,1.0
8901063363960,Brittania Gobbles Chocolate Cake,Brittania,Snacks,"['en:e102', 'en:e122', 'en:e133', 'en:e150c', 'en:e150d', 'en:e282', 'en:e322', 'en:e341', 'en:e415', 'en:e420', 'en:e422', 'en:e476', 'en:e477', 'en:e500']","['en:eggs', 'en:gluten', 'en:milk']","REFINED WHEAT FLOUR (MAIDA), SUGAR, EGGS, EDIBLE HYDROGENATED VEGETABLE OIL&REFINED PALMOLEIN OIL, HUMECTANTS (420) & 422), HIGH MALTOSE SYRUP, LIQUID GLUCOSE COCOA SOLIDS (2%), SWEETENED CONDENSED MILK, COLOURS (150c, 150d, 102, 122, 132 & 133), CAKE GEL (EMULSIFIERS & STABILIZERS (471&477) AND HUMECTANT (420)}1, RAISING AGENTS (341()& 500)], INVERT SUGAR SYRUP, IODIZED SALT, PRESERVATIVES (200 &282), BAKING POWDER, PLAIN CHOCOLATE (0.14%) /SUGAR, COCOA BUTTER, COCOA SOLIDS EMULSIFIERS (322) & 476] AND ARTIFICIAL (VANILLA) FLAVOURING SUBSTANCE), FLAVOURS [NATURE IDENTICAL AND ARTIFICIAL (VANILLA & CHOCOLATE) FLAVOURING SUBSTANCES) AND STABILIZER (415).",e,https://images.openfoodfacts.org/images/products/890/106/336/3960/front_en.3.400.jpg,1792.0,6.0,56.0,29.5,20.0,10.0,0.0,0.0,14.0,3.0,2.0
8901207005374,Honey,Dabur,Petit-déjeuners,,[],,d,https://images.openfoodfacts.org/images/products/890/120/700/5374/front_fr.3.400.jpg,1339.0,0.0,80.0,80.0,0.0,0.0,0.17,0.0,,0.0,3.0
8908005144014,Multigain energy bar,,Snacks,"['en:e322', 'en:e322i', 'en:e392']",['en:soybeans'],"Whole Grains 36% (Brown Rice, Millets (Saamai, Foxtail). Rolled Oats 15%). Honey 20% Almonds 12%, Dates, Seeds 9% (Sunflower, Chia), Rice Crispies. Belgian Dark Chocolate 6% (Cocoa, Brown Sugar, Cocoa Butter, Soya Lecithin), Peanut Protein Powder. CONTAINS ADDED NATURAL FLAVOUR (Rosemary Extract. Vanilla Extract)",b,https://images.openfoodfacts.org/images/products/890/800/514/4014/front_fr.3.400.jpg,657.0,4.7,24.3,7.6,5.6,1.0,0.0,3.2,3.0,1.0,4.0
8901063363779,Britannia cake fruity fun,Britannia,Snacks,"['en:e102', 'en:e110', 'en:e1450', 'en:e282', 'en:e330', 'en:e341', 'en:e412', 'en:e415', 'en:e420', 'en:e435', 'en:e466', 'en:e472e', 'en:e477']","['en:eggs', 'en:gluten']","REFINED WHEAT FLOUR (MAIDA), SUGAR, EGGS, HYDROGENATED VEGETABLE OIL & REFINED PALMOLEIN OIL, FRUIT PRODUCTS (7.3%) (GLAZED FRUITS (PAPAYA CUTS, SUGAR, COLOURS (124 & 110), PINEAPPLE CUTS) & ORANGE PULP), HUMECTANTS (422 & 420 HIGH MALTOSE E SYRUP, EDIBLE MAIZE STARCH, PENTA CAKE (RAISING AGENTS 1450, 500m, 341, 341m), EMULSIFIERS (472e, 466, 435, STABILIZER (412) & ACIDITY REGULATOR (330)), RAISING AGENTS [34101, 500m) & 4500), NATURE IDENTICAL & ARTIFICIAL (MIXED FRUIT & VANILLA) FLAVOURING SUBSTANCES, CAKE GEL (EMULSIFIERS AND STABILIZERS (471 & 477) AND HUMECTANT (420), IODISED SALT, INVERT SUGAR SYRUP, PRESERVATIVES (202&282), BAKING POWDER, ACIDITY REGULATOR (330), STABILIZER (415) AND COLOUR (102). (Numbers in brackets as per International Numbering System) CONTAINS WHEAT AND EGGS",d,https://images.openfoodfacts.org/images/products/890/106/336/3779/front_en.19.400.jpg,1745.0,6.1,58.0,27.1,17.8,1.5,0.535,,13.0,2.0,2.0
8901808000068,weikfield custard powder vanilla,Weikfield,Dessert sauces,"['en:e102', 'en:e110', 'en:e122']",[],"Maize Starch, Iodized Salt, Artificial Flavouring Substance(Vanilla), Synthetic Food Colours (INS 102,110,122)",c,https://images.openfoodfacts.org/images/products/890/180/800/0068/front_en.11.400.jpg,1498.0,1.0,88.4,0.0,0.0,0.0,0.7,,3.0,0.0,4.0
8904083302100,Fruit yogurt blueberry,,Fruit yogurts,"['en:e122', 'en:e133', 'en:e202', 'en:e330', 'en:e440']",['en:milk'],"Milk & Milk Solids, Sugar, Active Lactic Culture (Lbacillus delbrueckii subsp. bulgaricus, S.thermophilus), Stabilizing agent (INS 440), Fruit Content (6%) from Blueberry preparation (Blueberry Fruit, Sugar, Water, Stabilizer (INS 440), Acidifying agent (INS 330), Preservative (INS 202)), Colours (INS 122, INS 133), Flavor (Nature - Identical Flavoring Substances - Blueberry). Allergen Information: Contains Milk. Manufactured & Marketed by: MILKY MIST DAIRY FOOD PRIVATE LIMITED SF No.: 43/1,2,3, Pattakaranpalayam Village, Perundurai Taluk - 638 057, Erode District, fssai Tamil Nadu, India. Lic. No. 10017042003191 FOR FEEDBACK/ QUERIES CONTACT OUR CUSTOMER CARE EXECUTIVE TOLL FREE NUMBER 1800-419-9000 OR CONTACT AT MFD. & MARKETED BY ADDRESS Write to us: customercare@milkymist.com/ visit us at: www.milkymist.com Net Quantity: 100 g For Batch No., Date of Packaging, Expiry Date MRP (incl. of all taxes) - SEE TOP OF THE PACK",unknown,https://images.openfoodfacts.org/images/products/890/408/330/2100/front_en.15.400.jpg,435.0,3.6,15.3,9.1,3.1,0.0,,,5.0,1.0,4.0
8904272600154,Storia Tender Coconut Water,Storia,Beverages and beverages preparations,,[],,b,https://images.openfoodfacts.org/images/products/890/427/260/0154/front_en.14.400.jpg,84.0,0.1,5.1,0.0,0.0,0.0,0.0525,,,0.0,5.0
8901725000622,sunfeast Mom,Sunfeast,Snacks,,[],,unknown,https://images.openfoodfacts.org/images/products/890/172/500/0622/front_en.3.400.jpg,,,,,,,,,,0.0,5.0
8902080304349,7up 2.25,7up,Beverages and beverages preparations,,[],,e,https://images.openfoodfacts.org/images/products/890/208/030/4349/front_en.3.400.jpg,47.0,0.0,11.7,11.7,0.0,0.0,0.045,0.0,,0.0,4.0
8901030919305,pizza & pasta sauce,Knorr,Sauces,"['en:e1422', 'en:e211', 'en:e260', 'en:e415']",['en:soybeans'],"Water, Vegetables (Crushed Tomato - 25%, Diced Tomato - 20%, Chopped Onion-3.5% and Garlic Paste-2.5%), Sugar, lodised Salt, Soyabean Oil, Stabilisers - E1422, E415, Acidity Regulator - E260, Herbs (Oregano and Basil - 0.12%), White Pepper Powder, Preservative-E211",d,https://images.openfoodfacts.org/images/products/890/103/091/9305/front_en.3.400.jpg,347.0,1.4,14.0,10.7,2.4,0.4,2.2725,1.0,4.0,1.0,2.0
8902579002442,Appy fizz,Parle,Plant-based foods and beverages,"['en:e150d', 'en:e211', 'en:e290', 'en:e296', 'en:e300', 'en:e331', 'en:e440']",[],"WATER, SUGAR, CARBONATING AGENT (INS 290), ACIDITY REGULATORS (INS 296, INS 331, INS 300), STABILIZER (INS 440), NATURAL COLOUR (INS 150d), PRESERVATIVE (INS 211), ANTIOXIDANT (INS 300)",e,https://images.openfoodfacts.org/images/products/890/257/900/2442/front_en.3.400.jpg,217.0,0.0,12.95,12.9,0.0,0.0,0.0,0.0,7.0,0.0,4.0
8901058901511,2-minute noodles,Maggi,Plant-based foods and beverages,['en:e412'],['en:gluten'],"refined wheat flour, palm oil, calcium carbonate, potassium chloride, sodium phosphate, potassium carbonate, sodium carbonate, guar gum",unknown,https://images.openfoodfacts.org/images/products/890/105/890/1511/front_en.8.400.jpg,1787.0,8.0,63.5,2.2,15.7,6.8,1.172,3.6,1.0,1.0,4.0
8901499008800,Kellogg's chochos,Kellogg's,,[],[],chocos,unknown,https://images.openfoodfacts.org/images/products/890/149/900/8800/front_en.9.400.jpg,,,,,,,,,0.0,0.0,5.0
8901725104641,Sunfeast moms magic cashew almond,Sunfeast,,[],[],biscuit,unknown,https://images.openfoodfacts.org/images/products/890/172/510/4641/front_en.6.400.jpg,,,,,,,,,0.0,0.0,5.0
3948764022913,fanta coca cola,Everest Turmeric powder tikha lal,Beverages,[],[],Everest black pepper,unknown,https://images.openfoodfacts.org/images/products/394/876/402/2913/front_en.15.400.jpg,,,,,,,,,0.0,0.0,5.0
8901030877131,Real Mayonnaise,Hellmann's,Snacks,"['en:e1442', 'en:e1450', 'en:e202', 'en:e385']",['en:soybeans'],"Refined Soybean Oil (Fortified with Vitamin A & D), Water, Sugar, Thickeners-E 1442, E 1450, Natural Vinegar, lodised Salt, Spices & Condiments, Lemon Juice Concentrate, Preservative-E 202, Nature Identical and Natural Flavouring Substances, Sequestrant-E 385. May contain traces of Soya.",e,https://images.openfoodfacts.org/images/products/890/103/087/7131/front_en.8.400.jpg,2092.0,0.0,6.6,4.0,52.6,8.4,1802.5,0.0,4.0,1.0,2.0
8906032018513,Doodh Biscuits,Patanjali,Snacks,"['en:e223', 'en:e319', 'en:e322', 'en:e341', 'en:e500', 'en:e500ii', 'en:e503', 'en:e503ii']","['en:gluten', 'en:milk', 'en:soybeans', 'en:sulphur-dioxide-and-sulphites']","Wheat Flour (Atta )- 58.6%, Edible Vegetable Oil (Palm), Sugar, Liquid Glucose, Milk Solids (1.7%), lodized Salt, Leavening agents [INS-500(ii), INS 503(ii), INS - 341(1), Cheese, Dough Conditioner (INS 223), Antioxidant (INS 319), Emulsifier [INS 322). Natural, Nature Identical Artificial Flavouring Substances (Milk & Vanilla). CONTAINS WHEAT, MILK, SOY, SULPHITE",e,https://images.openfoodfacts.org/images/products/890/603/201/8513/front_en.3.400.jpg,1958.0,7.2,72.0,24.0,17.0,8.3,0.8725,6.0,8.0,4.0,2.0
8906002482450,Snickers Chocolate Bar,Mars,Snacks,['en:e322'],"['en:milk', 'en:nuts', 'en:peanuts', 'en:soybeans']","Chocolate (Sugar, Cocoa Butter, Cocoa Mass, Lactose, Full Cream Milk Powder, Whey Powder, Milk Fat, Emulsifier (Soya Lecithin E322), Water, Artificial Flavour (Vanillin)), Peanuts, Glucose Syrup, Sugar, Vegetable Fat(Palm Fat), Skimmed Milk",e,https://images.openfoodfacts.org/images/products/890/600/248/2450/front_en.7.400.jpg,2054.0,8.83,57.43,51.84,25.1,10.18,0.555,,1.0,4.0,2.0
8906036670212,Curd,Nandini,Milk curds,[],['en:milk'],Milk Solids (Toned Milk) & Active Culture Allergen Advice: contains Milk,b,https://images.openfoodfacts.org/images/products/890/603/667/0212/front_en.3.400.jpg,251.0,3.7,4.4,4.4,3.1,2.0,0.125,,0.0,1.0,5.0
8906009070445,unibic choco kiss,Unibic,,,[],,unknown,https://images.openfoodfacts.org/images/products/890/600/907/0445/front_en.4.400.jpg,,,,,,,,,,0.0,5.0
8908008674808,Wafer,Nabati,en:stuffed-wafers,,[],,e,https://images.openfoodfacts.org/images/products/890/800/867/4808/front_en.3.400.jpg,1979.0,7.0,73.0,34.0,17.0,10.0,1.9,,,0.0,0.0
8901207026553,Honey,Dabur,Breakfasts,[],[],Honey,e,https://images.openfoodfacts.org/images/products/890/120/702/6553/front_en.9.400.jpg,,,,,,,,,0.0,0.0,5.0
8901063093393,Good day cashew cookies,Britannia,en:biscuits,[],[],"NUTRITION INFORMATION Serving Size: 15g (approx, 2 Beguns) No of Servings per pack - About 17 Approx Values per 100 g Energy Protein Carbohydrate of which Total Sugars Added Sugars Total Fat Saturated fatty acids Meno unsaturated fatty acids Poly unsaturated fatty acids Trans fatty acids Cholestorol Sodia 508 kcal 66 g 677 211 208 234 115 g 91 g 24 g 0 g 32 mg 221 m Serve %) ROA 2",e,https://images.openfoodfacts.org/images/products/890/106/309/3393/front_en.3.400.jpg,2125.0,6.6,67.7,67.7,23.4,11.5,0.5675,,0.0,0.0,1.0
8901063142114,Britannia Nutri Choice Oats,Britannia,Biscuits,"['en:e150d', 'en:e322', 'en:e450', 'en:e472e', 'en:e500', 'en:e503']","['en:gluten', 'en:milk', 'en:nuts', 'en:soybeans']","WHEAT FLOUR (ATTA) (41.7%), SUGAR, REFINED PALM OIL, ROLLED DATS (14.3%), ALMONDS (5%), LIQUID GLUCOSE, WHEAT BRAN (2.4%), MALTODEXTRIN, RAISING AGENTS [500(ii), 503(ii) & 450(i)], MILK SOLIDS (1.6%), INVERT SUGAR SYRUP, DATS FIBRE (0.8%), EMULSIFIERS [322(i), 471 & 472e], FLAVOURS [ARTIFICIAL (MILK & BUTTER), NATURAL & NATURE IDENTICAL FLAVOURING SUBSTANCES], IODISED SALT AND COLOUR (150d). (Numbers in brackets as per International Numbering System) CONTAINS WHEAT, OATS, NUTS, MILK AND SOYA.",d,https://images.openfoodfacts.org/images/products/890/106/314/2114/front_en.3.400.jpg,1999.95,8.0,68.5,19.5,21.0,8.6,0.385,8.4,6.0,4.0,3.0
7622201762476,Dairy Milk Minis,Cadbury,Snacks,,[],,e,https://images.openfoodfacts.org/images/products/762/220/176/2476/front_en.9.400.jpg,2226.0,7.8,60.4,57.0,29.2,19.6,0.3225,,,0.0,1.0
8901491410106,Uncle Chiprs,10 rs,en:potato-crisps,"['en:e1450', 'en:e14xx', 'en:e150d', 'en:e296', 'en:e330', 'en:e334', 'en:e470', 'en:e551', 'en:e627', 'en:e631']",['en:milk'],"Potato, Edible Vegetable Oil (Palmolein), &quot;Seasoning (Sugar, lodised Salt, &quot;Spices and Condiments, Acidity Regulators (330, 334, 296), Maltodextrin, Edible Starch, Salt Substitute (Potassium Chloride), Milk Solids, Anticaking Agents (551,470), Flavour Enhancers (631, 627), Color (150d), Flavour (Natural and Nature Identical Flavouring Substances), Modified Starch (1450)). *As flavouring agent. &quot;Contains Onion ALLERGEN ADVICE: Contains Milk .co.in/en-IN/live/story/uncle-chipps",unknown,https://images.openfoodfacts.org/images/products/890/149/141/0106/front_en.20.400.jpg,,,,,,,,,10.0,1.0,5.0
8901491502016,Classic Salted Potato Chips,Lay's,Potato crisps,,[],,unknown,https://images.openfoodfacts.org/images/products/890/149/150/2016/front_en.5.400.jpg,,,,,,,,,,0.0,5.0
89000601,limca,coco-cola,Beverages and beverages preparations,"['en:e211', 'en:e330', 'en:e331']",[],"CARBONATED WATER, SUGAR, ACIDITY REGULATORS (330, 331(iii)), STABILIZERS 14,471 PRESERVATIVE (211), FLAVOURS (NATURAL, NATURE-IDENTICAL & ARTIFICIAL (LEMON) FLAVOURING SUBSTANCES).",e,https://images.openfoodfacts.org/images/products/000/008/900/0601/front_en.3.400.jpg,184.0,0.0,11.1,20.14,0.0,,0.0,,3.0,0.0,4.0
8901725013738,Chips,Bingo,Chips,,[],,unknown,https://images.openfoodfacts.org/images/products/890/172/501/3738/front_en.3.400.jpg,2213.0,5.7,59.8,1.8,30.1,13.9,,,,0.0,4.0
8906009532356,Max protein daily choco almond bar,Ritebite,Snacks,"['en:e322', 'en:e322i', 'en:e330', 'en:e412', 'en:e422', 'en:e965']","['en:milk', 'en:nuts', 'en:soybeans']","Protein Blend (29%) (Soy Nuggets, Whey Protein Concentrate, Calcium Caseinate, Soy Concentrate), Dietary Fiber (16%) (Fructooligosacharide), Dark Compound No Added Sugar (12%) (Maltitol, Edible Vegetable Fat (Hydrogenated), Cocoa Solids, Emulsifier (Soy Lecithin)), Maltitol, Whole Grain Rolled Oats (8%), Almonds (7%), Brown Rice Crispy, Edible Vegetable Oil (High Oleic Sunflower Oil), Humectant (Glycerine), Cocoa Powder, Cocoa Mass, Flaxseeds, Tribasic Calcium Phosphate, Emulsifier (Soy Lecithin), Binding Agent (Guar Gum), Soy Protein Isolate, Salt and Citric Acid, Antioxidants (Vitamin C), Added Vitamins and Minerals. IDENTICAL FLAVOUR(S))",not-applicable,https://images.openfoodfacts.org/images/products/890/600/953/2356/front_en.10.400.jpg,1500.0,20.0,39.0,1.0,13.6,2.4,,27.4,6.0,3.0,7.0
8906005508904,Bikaji mobile bhel chowpati bhelpuri,Bikaji,snacks,['en:e330'],"['en:gluten', 'en:peanuts']","Edible Vegetable Oil (Palmolein oll, Cotton Seed Oil), Puffed Rice (17%), Chick Pea (10%), Peanuts (79%), Gram Flour, Dew Bean Flour (Moth Flour), Wheat Flour, Rice Flakes, Dates (2%), Sugar, Ground Spices and Condiments (lodised Salt, Red Chilli, Coriander, Turmeric (Colouring & Spices), Cumin, Black Salt, Dry Green Chilli, Dry Red Chilli, Garlic, Dry Mango, Dry Cassia Leaves, Cinnamon, Ginger, Black Pepper, Cardamom, Clove, Nutmeg, Mace, Asafoetida, Acidity Regulator (INS330)",d,https://images.openfoodfacts.org/images/products/890/600/550/8904/front_en.3.400.jpg,2360.0,13.0,45.0,4.0,37.0,13.0,0.9925,8.0,1.0,2.0,5.0
7622201757250,,Oreo,cadbury,,[],,unknown,https://images.openfoodfacts.org/images/products/762/220/175/7250/front_en.7.400.jpg,,,,,,,,,,0.0,5.0
8901262152341,Amul Kool Premium Kesar Flavour,Amul,Beverages and beverages preparations,"['en:e102', 'en:e110']",['en:milk'],"Toned milk, sugar, milk solids, artificial flavouring substances (kesar), colours (102,110).",e,https://images.openfoodfacts.org/images/products/890/126/215/2341/front_en.3.400.jpg,381.0,3.11,12.5,12.5,3.17,1.94,0.108,,2.0,1.0,4.0
8901058001433,Rich Tomato Ketchup,Maggi,Condiments,,[],,d,https://images.openfoodfacts.org/images/products/890/105/800/1433/front_en.3.400.jpg,322.0,1.11,20.0,18.9,0.0,0.0,1.38,0.0,,0.0,3.0
0639382000393,,,,[],[],,unknown,,,,,,,,,,0.0,0.0,5.0
8901063093355,Good Day Cashew Cookies Medium Pack 600g,Britannia,Snacks,"['en:e322', 'en:e472e', 'en:e500', 'en:e503']","['en:gluten', 'en:milk', 'en:nuts', 'en:soybeans']","REFINED WHEAT FLOUR (MAIDA), REFINED PALM OIL, SUGAR, CASHEW NUTS (1.8%), INVERT SUGAR MILK SOLIDS, BUTTER (0.6%), RAISING AGENTS [503(ii) & 500(ii)], IODISED SALT, EMULSIFIERS (322(i), 471 & 472e] AND FLAVOURS [NATURE IDENTICAL AND ARTIFICIAL (MILK AND VANILLA) FLAVOURING SUBSTANCES].",e,https://images.openfoodfacts.org/images/products/890/106/309/3355/front_en.3.400.jpg,2109.0,7.0,65.0,22.0,24.0,11.0,0.0,0.0,4.0,4.0,3.0
8901262020046,Pure Milk Cheese Slices,Amul,en:cheeses,"['en:e200', 'en:e234', 'en:e331', 'en:e452']",['en:milk'],"Cheese, Milk Solids, Permitted Emulsifying Salts (E331 & E452) & Common Salt. CONTAINS PERMITTED CLASS II PRESERVATIVES (E200 & E234) BEST BEFORE 9 MONTHS FROM PACKAGING WHEN STORED REFRIGE",e,https://images.openfoodfacts.org/images/products/890/126/202/0046/front_fr.4.400.jpg,1301.0,20.0,1.5,1.5,25.0,16.0,3.0,,4.0,1.0,3.0
8901262150064,Amul Taaza 1ltr,Amul,Dairies,[],['en:milk'],Milk,c,https://images.openfoodfacts.org/images/products/890/126/215/0064/front_en.16.400.jpg,244.0,3.0,4.8,4.8,3.0,2.0,0.0925,0.0,0.0,1.0,5.0
8901499008183,Corn Flakes Original,Kellogg's,Plant-based foods and beverages,['en:e320'],[],"corn grits 87.7%, sugar, malt extract, iodized salt, vitamins, INS320",d,https://images.openfoodfacts.org/images/products/890/149/900/8183/front_en.14.400.jpg,1590.0,6.6666666666667,87.0,8.3333333333333,1.0,0.66666666666667,1.25,2.6666666666667,1.0,0.0,3.0
8901764041259,Thums Up 300ml can,Coca Cola,Beverages,"['en:e150d', 'en:e338']",[],"Carbonated Water, Sugar, Acidity Regulator (338), Caffeine. Contains permitted natural colour (150d) and added flavours (natural, nature-identical and artificial flavouring substances (cola flavour)).",e,https://images.openfoodfacts.org/images/products/890/176/404/1259/front_en.9.400.jpg,167.0,0.0,10.0,10.0,0.0,0.0,0.0,,2.0,0.0,4.0
8904004403718,Moong Dal,Haldiram's,Plant-based foods and beverages,[],[],"Split Pulse Moong (Moong Dal) (77 %), Cotton Seed Oil Refined & lodised Salt.",c,https://images.openfoodfacts.org/images/products/890/400/440/3718/front_en.4.400.jpg,1992.0,21.31,50.66,0.0,20.93,5.64,0.975,7.52,0.0,0.0,6.0
8902579103170,FROOTI Mango Drink,Parle Agro,Beverages and beverages preparations,"['en:e202', 'en:e211', 'en:e224', 'en:e300', 'en:e330', 'en:e331', 'en:e331iii']",[],"Water, Mango Pulp (19.5%), Sugar, Acidity Regulators [INS330, INS331(iii)], Preservatives (INS211, INS224, INS202), Antioxidant (INS300)",e,https://images.openfoodfacts.org/images/products/890/257/910/3170/front_en.7.400.jpg,272.0,0.0,16.2,13.3,0.0,0.0,0.0,0.0,7.0,0.0,4.0
8901042969725,Gulab Jamun,MTR,Dessert mixes,"['en:e296', 'en:e500', 'en:e500ii']",[],"Refined wheat flour (Maida), Milk solids (18%), Interesterified vegetable fat, Raising agent [INS 500 (ii)] and Acidity regulator (INS 296). Allergen Advice: Contains Wheat Gluten and Milk.",unknown,https://images.openfoodfacts.org/images/products/890/104/296/9725/front_en.25.400.jpg,0.0,14.0,60.0,3.3,10.4,6.0,0.0,0.0,3.0,0.0,5.0
19017198,,Parle,100g wheat per amount,['en:e223'],[],"FARINE DE BLE, HUILE VEGETALE ČOMESTĪBLE, LEVURE, EXTRAIT DE MALT, SEL, EMULSIFIANT D'ORIGINE VEGÉTALE (ESTERS D'ACIDE DIACETYLTARTRIQUE DE MONO ET DIGCEDIDES (E 47 META BISULFITE DE SODIUM (E 223] ET AMYLASE (E 11C 2. AP MP GH",unknown,https://images.openfoodfacts.org/images/products/000/001/901/7198/front_en.4.400.jpg,,9.2,72.7,0.0,,,0.1,0.0,1.0,0.0,6.0
3564706633872,Torti surimi,Menu Fraîcheur,entrées,"['en:e14xx', 'en:e160c', 'en:e202', 'en:e415', 'en:e450', 'en:e451']","['en:celery', 'en:eggs', 'en:fish', 'en:gluten']","Pates alimentares cuites 3% semoule de blé dur, sell: eau; surimi 15% (eal, chair de poisson, amidon dont ble amidon modifie huile de soja sucre, set colorant: extrait de paprika, stabilisants: E450, E451); huile de colza; poivron rouge; vinagre d'alcool; jus de cron à base concentré; amidon modifié de pomme de teme; whisky; vinaigre de xeres; moutarde aan de moula d'alcool, se); sel; sucre ; jaune d'oeuf en poudre; congervateur: E202; ciboulette des ha épaississant: gomme xanthane; poivre; échalote déshydratée; poudre de betterave; artimes caramel ordinaire. Traces de: céleri, autres céréales contenant du gluten, crustacés graines de sésame et soja.",c,https://images.openfoodfacts.org/images/products/356/470/663/3872/front_en.10.400.jpg,778.0,4.2,17.0,1.5,11.0,0.7,0.93,,6.0,4.0,4.0
8901542001932,Complan,Zydus Wellness,,['en:e162'],['en:milk'],"Milk Solids (54.9%), Sugar, Peanut Oil, Maltodextrin, Caramel (INSI500), Minerals, Beet Red INS162), Vitamins., Inosital, Taurine, L-Carnitine, CONTAINS PERMITTED NATURAL COLOURS AND ADDED FLAVOURS (CHOCOLATE-ARTIFICIAL FLAVOURING SUBSTANCES) Contains Milk Solids Peanut Oil May contain traces of Nuts, Wheat and Soya. OTHER NUTRIENTS: Inasitol: 30 mg, Carnitine: / mg",unknown,https://images.openfoodfacts.org/images/products/890/154/200/1932/front_en.11.400.jpg,,,,,,,,,1.0,1.0,5.0
8901491702188,Oats,Quaker,,,[],,unknown,https://images.openfoodfacts.org/images/products/890/149/170/2188/front_en.3.400.jpg,1700.0,11.8,68.5,1.75,9.5,2.0,0.0238,10.0,,0.0,7.0
8901725123123,iodized salt,aashirvaad,Condiments,"['en:e336', 'en:e551']",[],"EDIBLE COMMON SALT, ANTICAKING AGENTS (INS 551, INS 336) AND POTASSIUM IODATE",not-applicable,https://images.openfoodfacts.org/images/products/890/172/512/3123/front_en.13.400.jpg,0.0,0.0,0.0,0.0,0.0,0.0,39.1,0.0,2.0,0.0,3.0
8901491366229,Kurkure Solid Masti Masala Twisteez Crisps,Kurkure,Namkeen,"['en:e296', 'en:e330', 'en:e334']",['en:milk'],"Edible Vegetable Oil (Palmolein), Edible Starch, Besan (20.1%), Rice Flour (15.3%), Potato Powder, lodised Salt, *Seasoning (~Spices and Condiments, Maltodextrin, lodised Salt, Black Salt, Milk Solids, Acidity Regulators (330, 296, 334), Flavour (Natural and Nature Identical Flavouring Substances), Sugar, Tomato Powder)
*As flavouring agent. ~Contains Onion
ALLERGEN ADVICE: Contains Nuts, Milk
May Contain Sulphite",e,https://images.openfoodfacts.org/images/products/890/149/136/6229/front_en.15.400.jpg,2211.0,8.6,58.7,0.5,28.7,12.9,2.195,,3.0,1.0,3.0
8904258700465,Raw,Raw,Plant-based foods and beverages,"['en:e224', 'en:e300']",[],"VALENCIA ORANGE JUICE (99.8%), CITRUS FIBER, ANTIOXIDANTS [(INS 224), VITAMIN C-INS 300] CONTAINS NATURALLY OCCURING SUGARS",unknown,https://images.openfoodfacts.org/images/products/890/425/870/0465/front_en.5.400.jpg,193.0,0.64,10.75,8.76,0.04,,0.0105,,2.0,0.0,4.0
8904004401172,Khatta Meetha,Haldiram,Plain salty snacks,['en:e330'],['en:peanuts'],"Refined Palmolein Oil, Rice Flakes (22%) , Bengal Gram Flour (Besan) (21%), Refined Sugar, Split Pulse Bengal Gram (Chana Dal) (7%) Groundnuts (Peanuts) (5%), Sago (4%), Red Lentils (Masur Whole) (2.5%), Edible Common Salt, Black Salt, Turmeric Acidity Regulator (INS 330), Red Chilli, Ajwain, Raising Agent S500i) & Asafoetida tard Seed",d,https://images.openfoodfacts.org/images/products/890/400/440/1172/front_en.6.400.jpg,2218.0,9.26,57.38,4.26,29.25,12.48,0.0,4.01,1.0,1.0,6.0
8480024754288,Barritas de platano y chocolate,Alteza,Snacks,,[],,e,https://images.openfoodfacts.org/images/products/848/002/475/4288/front_en.7.400.jpg,1774.0,5.8,69.0,29.0,13.0,6.4,0.4,,,0.0,1.0
8901491101820,Potato Chips - Spanish Tomato Tango,Lay's,Plant-based foods and beverages,,[],,e,https://images.openfoodfacts.org/images/products/890/149/110/1820/front_en.37.400.jpg,2210.0,8.0,56.0,8.0,32.0,12.0,1.59,0.0,,0.0,1.0
8904063240248,Haldiram Bhujia 1kg,Haldiram's,Snacks,,[],,c,https://images.openfoodfacts.org/images/products/890/406/324/0248/front_en.9.400.jpg,837.0,4.0,15.0,1.0,14.0,4.0,0.7,2.0,,0.0,4.0
8901491001052,Lays salted Chips 30,Lay's,en:potato-crisps,,[],,e,https://images.openfoodfacts.org/images/products/890/149/100/1052/front_fr.3.400.jpg,2301.0,7.0,54.0,2.6,34.0,13.3,1.275,,,0.0,3.0
8906002004430,Veg mayonnaise,Dr. Oetker,Condiments,"['en:e1442', 'en:e202', 'en:e211', 'en:e260', 'en:e319', 'en:e330', 'en:e415']","['en:milk', 'en:soybeans']","Refined Soyabean Oil, Water, Sugar, Milk Solids, iodised Salt, Lemon Juice, Emulsifiers and Stabilizers (INS415, INS1442), Acidity Regulators (INS260, INS330), Preservatives (INS211, INS202), Antioxidant (INS319).  CONTAINS MILK.",e,https://images.openfoodfacts.org/images/products/890/600/200/4430/front_en.32.400.jpg,2103.0,0.5,8.6,7.3,51.8,9.2,1.80467,0.0,7.0,2.0,1.0
